{
  "version": "1.0.0",
  "updatedAt": "2026-08-02",
  "source": "domain_impact_receipts",
  "authority": "public_aggregate_only",
  "privacy": {
    "classification": "public_aggregate_only",
    "piiAllowed": false,
    "donorNamesAllowed": false,
    "individualDonorAttributionAllowed": false,
    "operatorIdentityAllowed": false
  },
  "summary": {
    "outcomeCount": 1,
    "totalParticipantsPublic": 18
  },
  "outcomes": [
    {
      "publicId": "imp_46fa8774a326",
      "impactEventId": "imp_class_2026_09_02",
      "organizationName": "Hacker Dojo",
      "programName": "Beginner Electronics Class",
      "allocationName": "Community Hardware Fund",
      "eventType": "CLASS_HELD",
      "eventDate": "2026-09-02",
      "participantsPublic": 18,
      "evidenceState": "VERIFIED",
      "description": "Beginner electronics class using donated equipment",
      "attributionMethod": "DIRECT_RESTRICTED",
      "receiptHash": "46fa8774a3260f64b5d179bf2bf0eacb453673329ad54defe6e65c187844888b",
      "createdAt": "2026-09-02T18:00:00+00:00"
    }
  ]
}
